Name	Title	Coding
t3_17psy6w	Taking 1 semester off as an international student	Advice
t3_17r3gco	I just hope directions will look to the past and act so history won't repeat itself	Annoucement
t3_17qt6ji	JMSB requirements	Advice
t3_17q50zj	As a MEP student who has just been accepted into the Arts &amp; Science Certificate with the Intentions of transferring into Computer Science, should I disregard the requirements to complete the cert?	Advice
t3_17rfuk7	Exercise science students at Loyola	Annoucement
t3_17qr7fz	SPAN 202	Course information
t3_17aqb57	Applying to Concordia MEGATHREAD (undergrad only) - Have questions about admission requirements, the application process or anything else? Ask them here!	Advice
t3_17pz4p9	How hard is it to switch programs?	Advice
t3_17rik3r	Full time or part time	Advice
t3_17q0iyj	CAQ Taking more than 25 working days	Rant
t3_17rgjpn	Fee levy opt outs	Annoucement
t3_17qx956	Comm 305	Course information
t3_17qin7h	What if universities don’t comply with tuition hikes?	Advice
t3_17rjaa4	Police	Annoucement
t3_17pg304	Second degree	Advice
t3_17qddjg	Is it fine to wear a hat or a cap during exams?	Advice
t3_17r247t	Trending on Twitter for all the wrong reasons	Rant
t3_17slir3	Comp 352: Does this class get curved at the end ?	Course information
t3_17rxzfh	sphrconu statement regarding November 8.	Annoucement
t3_17s5496	MATH208 Midterm Grade	Course information
t3_17q0y4b	How much credit to be full time during summer?	Advice
t3_17t2oi0	Thoughts on Phil 235 Biomedical Ethics?	Course information
t3_17sg4io	CSU Fall By-Election Results are in	Annoucement
t3_17pyjmz	Recreation facilities	Annoucement
t3_17plqg3	Co-op	Advice
t3_17qyfaf	Math 209	Course information
t3_17p6u4e	What's your opinion on the Link's petition to increase their levy fees 110%?	Annoucement
t3_17qweo2	Clean bathrooms	Annoucement
t3_17qap1x	Is comm205 an easy b? Or it’s difficult	Course information
t3_17pymw4	Vote “NO” for CSU Fee increases	Annoucement
t3_17r344d	What actually happened in the H building today	Campus incident
t3_17qg3ic	Jmsb mature students	Annoucement
t3_17qb6sx	Going from udem to concordia, grades conversion	Advice
t3_17scpim	COMP248- Dr. Molokwu	Course information
t3_17qadig	MPPPA Program	Advice
t3_17qvwo0	What are the easiest electives?	Course information
t3_17qaybq	Is mark201 easy? Explain please !!!	Course information
t3_17r8r2s	Does this sound like somthing Zionests would do?	Advice
t3_17s2wtm	I just saw someone saying sharamouta ya wald al haram to a Mcgill student near JSMB washrooms...any idea?	Campus incident
t3_17qhmul	Job in montreal	Advice
t3_17sl2nh	AFE quebec student Loan repayment calculation	Advice
t3_17po1j2	Mech eng co-op or not?	Advice
t3_17siidt	extra assignment for bonus points	Advice
t3_17rfz75	BCompSci Math Requirements	Advice
t3_17rf83r	Statement from the accused.	Campus incident
t3_17semyi	Co-op	Advice
t3_17runw8	Do you guys think I’ll get into jmsb with a 2.67 gpa?	Advice
t3_17rieql	UdeM Professor Yanise Arab yells at a Jewish student in Concordia to “go back to Poland, sharmouta (wh*re)”	Campus incident
t3_17q9lqk	Is the Kenneth Woods Portfolio Management only for year 1 students?	Advice
t3_17qzysu	M.Eng in Information Systems Security	Advice
